PERGUNTAS,RESPOSTAS
Gustavo Rodrigues Pedrino,"Graduado em Ciências Biológicas (Modalidade Médica) pela Universidade Federal de São Paulo (UNIFESP). Mestre e Doutor em Ciência pelo Programa de Pós-Graduação em Farmacologia da mesma instituição, onde também realizou pós-doutorado. Durante o doutorado, foi Research Fellow no Department of Physiology da University of Texas Health Science Center at San Antonio. Pós-doutor na UNIFESP. Atualmente, é Professor Associado IV no Departamento de Ciências Fisiológicas do Instituto de Ciências Biológicas da Universidade Federal de Goiás (ICB/UFG), onde coordena o Centro de Pesquisas em Neurociências e Fisiologia Cardiovascular. Diretor do ICB/UFG e Vice-Coordenador do Curso de Pós-Graduação Lato Sensu em Fisiologia Humana Aplicada às Ciências da Saúde. Preside o Conselho Deliberativo da Sociedade Brasileira de Fisiologia (SBFis) e atua como Tesoureiro da Federação de Sociedades de Biologia Experimental (FeSBE). Bolsista de Produtividade em Pesquisa Nível 1C do CNPq. Suas pesquisas focam: A influência do processo inflamatório central sobre a hiperatividade neuronal em doenças cardiovasculares; Os mecanismos neurais envolvidos na melhora cardiovascular com o treinamento físico; Polimorfismos das enzimas conversoras de angiotensina e a susceptibilidade ao desenvolvimento de doenças cardiovasculares; A fisiofarmacologia pré-clínica de produtos naturais e sintéticos. Fisiologia Humana Aplicada às Ciências da Saúde"
Ilirio José Rech,"Doutor em Contabilidade e Controladoria pela FEA/USP (2012) com tese defendia na área de mensuração de ativos biológicos. Mestre em Contabilidade pela Universidade de Brasília (UnB – 2006). Graduado e pós Graduado em Ciências Contábeis pela Universidade Federal de Mato Grosso (1993, 2002). Professor Associado da Universidade Federal de Goiás – UFG e professor permanente do Programa de Mestrado em Ciências Contábeis da UFG e do programa de Mestrado e Doutorado da FACIC/UFU. Possui experiência na área de consultoria em atividades agropecuárias. Participa em projetos de avaliação de empresas na equipe da Funape/UFG. Coordena curso de pós graduação e pesquisas de iniciação científica financiadas pela FAPEMIG, FUNAPE, UFU e UFG nas áreas de avaliação de empresas e de adoção das IFRS aplicadas a empresas rurais, além de atuar no ensino de pós graduação nas áreas de Contabilidade Societária, Análise financeira e econômica, Planejamento e Contabilidade Internacional. Na Escola de Pós é docente do curso: Planejamento Tributário e Compliance Fiscal."
Jacson Rodrigues Barbosa,"Bacharel em Ciências da Computação pela Universidade Federal de Goiás (2007). Mestre em Ciências de Computação pelo Instituto de Informática da Universidade Federal de Goiás (2011). Doutor em Ciências de Computação pelo Instituto de Ciências Matemáticas e de Computação da Universidade de São Paulo (2021). Atualmente é docente no Instituto de Informática (INF) da Universidade Federal de Goiás (UFG). Tem experiência na área de Ciência da Computação, com ênfase em Engenharia de Software e Inteligência Artificial, atuando principalmente nos temas de Mineração de Repositórios de Software, aprendizado de máquina, mineração de dados e textos (data and text mining, predictive analytics, data science). Não atua em nenhum curso da Escola de Pós da UFG."
José Humberto Rodrigues dos Anjos,"Graduado em Letras, Português/Inglês e suas respectivas Literaturas pela Universidade Estadual de Goiás – UEG e em Pedagogia pela Faculdade Mantenense dos Vales Gerais – Intervale. Mestre em Estudos da Linguagem, pela Universidade Federal de Goiás – UFG. Doutor em Educação pela Universidade de Uberaba – UNIUBE. Possui experiência na área de Ensino de Literatura afro-brasileira, literatura produzida em Goiás e educação antirracista. Realizou estágio pós-doutoral no Programa de Pós-graduação em Estudos Literários da Universidade Estadual do Mato Grosso – UNEMAT, onde pesquisou o ensino de literatura afro-brasileira e africana na rede básica de educação. Atualmente é professor efetivo da Universidade Federal de Goiás – Campus Goiás no curso de Pedagogia, onde atua como coordenador da Especialização em Práticas Pedagógicas na Educação Básica, e no Núcleo de Estudos Afro-brasileiros e Indígenas – NEABI (DGP-CNPq). É docente colaborador do Programa de Pós-graduação Stricto Sensu (Mestrado Acadêmico) em Língua, Literatura e Interculturalidade POSLLI, da Universidade Estadual de Goiás – Campus Cora Coralina. Pesquisador associado à Associação Brasileira de Pesquisadores/as Negros/as – ABPN e da Associação Brasileira de Literatura Comparada – ABRALIC. Na Escola de Pós é docente do curso: Práticas Pedagógicas na Educação Básica."
Karla Emmanuela Ribeiro Hora,"Graduação em Arquitetura e Urbanismo pela Universidade Católica de Goiás – UCG (2001). Mestrado em Geografia pelo Instituto de Estudos Socioambiental da Universidade Federal de Goiás – IESA/UFG (2003). Doutorado em Meio Ambiente e Desenvolvimento pela Universidade Federal do Paraná – MADE / UFPR(2009). Atuou em funções de direção e técnica na administração pública municipal nas áreas de: planejamento urbano ambiental e saneamento ambiental. Exerceu a função de Diretora de Políticas para Mulheres no Ministério do Desenvolvimento Agrário (período de outubro/2012-março/2015) e de Diretora da Escola de Engenharia Civil e Ambiental (EECA) da UFG (período maio/2019 a maio/2023). É professora Associado, lotada na Escola de Engenharia Civil e Ambiental, da Universidade Federal de Goiás (EECA/UFG) e docente nos Programas de Pós Graduação Projeto e Cidade (PROCIDADES/FAV/UFG) e Ciências Ambientais (PPGCIAMB/UFG). Os temas recentes de pesquisa versam sobre: Planejamento Urbano e Ambiental; Agricultura Urbana e Periurbana; Tecnologias Sociais, Habitação Rural e Gênero; Gênero e Cidades; Conflitos socioambientais e o extrativismo agrário. Em outubro de 2024 foi indicada para vice-coordenadora do PPG Procidades/FAV. Na Escola de Pós é docente do curso: Vitivinicultura, Serviços e Produtos."
Larissa Matuda Macedo,"Graduada em Farmácia pela Universidade Federal de Goiás (2009). Mestre (2014) e Doutora (2018) em Ciências Biológicas pela Universidade Federal de Goiás. Atualmente, é Diretora de Pós-graduação Lato Sensu da Pró-Reitoria de Pós-Graduação da UFG. Membro da Câmara de Pesquisa e Pós-Graduação (CPPG-CEPEC-UFG), Comissão de Ética no Uso de Animais (CEUA/UFG), do Comitê de Integridade Acadêmica (CIA-UFG), e da Comissão Própria de Avaliação Institucional (CPA-UFG). Possui experiência em metodologia científica, fisiologia cardiovascular, biologia celular e molecular, e diagnóstico molecular de Covid-19. Atua nas áreas de bioengenharia e farmacologia celular, com ênfase em peptídeos bioativos e células-tronco mesenquimais. Na Escola de Pós é docente do curso: Vitivinicultura, Serviços e Produtos."
Luiz Carlos da Cunha,"Graduado em Farmácia pela Universidade Federal de Goiás (1989). Mestre em Fármacos e Medicamentos Química e Biologia (1993). Doutor em Fármacos e Medicamentos pela Faculdade de Ciências Farmacêuticas de São Paulo (1998). Professor de Toxicologia e Farmacocinética. Orientador de mestrado e doutorado do PPGCF-UFG, com linha de pesquisa na área de Farmacocinética, envolvendo métodos em cromatografia e espectrometria de massas. Ex-Coordenador do PPGCF e Membro da Sociedade Brasileira de Toxicologia. Diretor da Faculdade de Farmácia UFG. Linhas de Pesquisa: Toxicidade Experimental de produtos naturais e sintéticos; Farmacocinética Experimental e Clínica de produtos naturais e sintéticos; Toxicocinética. Na Escola de Pós é docente do curso: Farmácia Oncológica."
Manoel Francisco Biancardi,"Licenciatura e bacharelado em Ciências Biológicas pela Universidade Estadual Paulista (UNESP). Mestrado e Doutorado em Biologia Celular e Estrutural pela Universidade Estadual de Campinas (UNICAMP). Pós-doutorado na área de Ciências Biológicas pela Universidade Estadual de Campinas (UNICAMP). Atualmente é professor adjunto classe C junto ao Departamento de Histologia, Embriologia e Biologia Celular do Instituto de Ciências Biológicas da Universidade Federal de Goiás (UFG). Faz parte da equipe do Instituto Nacional de Ciência e Tecnologia em Fotônica Aplicada à Biologia Celular (INCT- INFABiC). Atua como coordenador do Laboratório de Biologia Celular Dinâmica (LaBCelDi) da UFG, Laboratório Associado Tipo II vinculado ao INCT-INFABiC. Corpo permanente do Programa de Pós-Graduação em Ciências Biológicas (PPGCB) da UFG, além de ser coordenador deste mesmo programa a partir de março de 2023. Possui experiência na área de Morfologia, com ênfase em Biologia Celular, Histologia e Biologia do Desenvolvimento, atuando principalmente nos seguintes temas da biologia da reprodução: Biologia dos sistemas urogenitais masculino e feminino; Ação de desreguladores endócrinos sobre a próstata; Organogênese prostática; Mecanismos de ação do TGFb1 sobre o desenvolvimento prostático e em modelos de cultura celular com células RWPE-1; Desenvolvimento e caracterização de lesões prostáticas em ratos espontaneamente hipertensos (SHR). Na Escola de Pós é docente do curso: Fisiologia Humana Aplicada às Ciências da Saúde."
Márcio de Carvalho Pires,"Graduação em Agronomia pela Escola Superior de Ciências Agrárias de Rio Verde (2001). Mestrado em Produção Vegetal pela Universidade de Brasília (01/2007). Doutorado em Agronomia (Produção Sustentável), pelo Programa de Pós-Graduação da Faculdade de Agronomia e Medicina Veterinária da UnB (01/2012). Pós-Doutorado em Melhoramento de fruteiras, Capes/UnB (2015). Atualmente é Professor Adjunto da Universidade de Brasília (UnB) onde ministra aulas nas seguintes disciplinas: Horticultura Geral, Fruticultura Tropical e Fruticultura Subtropical na Graduação e Propagação de Plantas Frutíferas; Citricultura e Viticultura na Pós-Graduação. Atual Coordenador do curso de Agronomia da Faculdade de Agronomia e Medicina Veterinária da FAV/UnB. Responsável pelo Laboratório de Fruticultura, orientação e condução de experimentos, ensaios laboratoriais, bolsistas e atividades de campo do Setor de Fruticultura EEB-FAV/UnB. Tem experiência na área de Agronomia, com ênfase em Melhoramento Vegetal e Fitotecnia, atuando principalmente nos seguintes temas: Fitossanidade, Propagação de plantas, Fisiologia de frutíferas, Produção e Pós-colheita. Atuou como consultor técnico pela United Nations Educational, Scientific and Cultural Organization – UNESCO e pela Food and Agriculture Organization of United Nations – FAO, ambos com foco no desenvolvimento de atividades de pesquisa. Não atua em nenhum curso da Escola de Pós da UFG."
Marina Carmello Cunha,"Graduada em Criação e Desenvolvimento de Produto em Moda e Bacharel em Negócios da Moda (UAM/2010). Mestre em Arquitetura e Urbanismo (PPGAU-FAUFBA/2014). Doutora em Ciências Sociais (PPGCS-UNICAMP/2020). Pós Doutora pelo PPG-Design (UAM/2023). Atuou profissionalmente principalmente na área de figurino para cinema e teatro. Possui interesse por pesquisas relacionadas aos processos de desenvolvimento de produto têxtil em contextos diversos, processos artesanais e experimentais com tecidos, tingimento, modelagem, artes gráficas, ilustração, vídeo-arte, fotografia e artesanato. Atualmente é professora no curso de Design de Moda da Universidade Federal de Goiás e colabora com projetos de desenvolvimento de produtos na ONG Coletivo Tem Sentimento. Na Escola de Pós é docente do curso: Moda e Inovação."
MBA EM​ Marketing Estratégico,"O curso pertence à área de Ciências Humanas e Ciências Sociais Aplicadas. O curso destina-se a profissionais (executivos ou empreendedores) que atuam diretamente ou indiretamente com a área de marketing. O curso de MBA em Marketing Estratégico tem como a proposta de fomentar os estudos de marketing no âmbito de ensino, pesquisa e extensão. Dessa forma, o curso irá oferecer a comunidade, por meio de professores do quadro efetivo da UFG e convidados, um ferramental para tomada de decisão com ênfase principal nas estratégias das empresas a partir de uma perspectiva mercadológica. Espera-se que, com a oferta do MBA em Marketing Estratégico, profissionais (executivos ou empreendedores) que atuam diretamente ou indiretamente com a área de marketing, possam ser habilitados a tomar decisões e contribuam para o melhor desempenho organizacional. Objetivos Específicos: a) Propiciar a capacitação na prática da gestão de marketing alinhado ao desempenhoorganizacional e estratégico; b) Desenvolver uma visão estratégica do marketing possibilitando aos participantes obter o ferramental necessário para tomada de decisão. Carga horária do curso: 365 horas. Modalidade Híbrida. Reconhecido pelo MEC. Início das aulas 01/02/2025. Taxa de matrícula de R$ 549,99; Valor da mensalidade: R$ 549,99. Para mais informações, acesse: https://escoladepos.ufg.br/cursos/marketing-estrategico/"
MBA em Planejamento Tributário e Compliance Fiscal,"O curso pertence à área de Ciências Sociais Aplicadas. O curso destina-se a gestores, auditores, tributaristas e contadores que desejam atuar em planejamento e compliance tributário. O curso de MBA em Planejamento Tributário e Compliance Fiscal capacita os profissionais das áreas de negócios e tributaristas a atuarem na área de planejamento e compliance tributária, desenvolvendo suas habilidades para conformidade fiscal e aplicação da legislação tributária atual. Assim suprindo os conhecimentos necessários para os profissionais desempenharem o que lhes couber no âmbito da gestão e compliance nas áreas em que atuam. Objetivos Específicos: a) Identificar habilidades necessárias para atuar na área que envolve o planejamento tributário e compliance fiscal; b) Execução e avaliação estratégica da Conformidade Tributária; c) Desenvolver a habilidade de planejamento e conformidade diante do arcabouço tributário brasileiro e suas recentes alterações; d) Fornecer conhecimentos acerca da aplicação dos conceitos de compliance fiscal e legislação tributária vigente. Carga horária: 390 horas. Modalidade 100% Presencial. Reconhecido pelo MEC.Início das aulas 21/02/2025. Valor da mensalidade: R$ 599,99. Para mais informações, acesse: https://escoladepos.ufg.br/cursos/mba-em-planejamento-tributario-e-compliance-fiscal/"
Mércia Pandolfo Provin,"Graduação em Farmácia e Bioquímica pela Universidade Estadual de Ponta Grossa (1989). Mestrado em Genética e Bioquímica pela Universidade Federal de Uberlândia (2003). Doutorado em Ciências da Saúde pela Universidade Federal de Goiás (2011). Atualmente é professora adjunto da Universidade Federal de Goiás. Tem experiência na área de Farmácia, com ênfase em Assistência Farmacêutica tanto na área assistencial quanto no ensino. Principais temas trabalhados: Direito a saúde e Assistência e Atenção farmacêutica. Na Escola de Pós é docente do curso: Farmácia Oncológica."
"Meu curso foi cancelado, o que devo fazer?","Você deve entrar em contato com a coordenação do curso, através do e-mail disponível na página do curso, ou com a Escola de Pós UFG, para entender os motivos do cancelamento e buscar orientações sobre possíveis soluções."
Nádia do Lago Costa,"Graduada em Odontologia (2007/UFG). Mestre em Odontologia (2010/UFG). Doutora em Ciências da Saúde (2012/UFG). Professora Associada da Disciplina de Diagnóstico Bucal e Odontologia Hospitalar da Faculdade de Odontologia da UFG. Especialista em Implantodontia (UFG). Habilitada em Odontologia Hospitalar e Laserterapia, atua como Coordenadora do Programa de Pós-Graduação em Odontologia da UFG. Coordenadora do Núcleo de Pesquisa em Prótese e Implante de UFG. Tem experiência nas áreas de patologia bucal, radiologia, estomatologia e odontologia para pacientes oncológicos, atuando principalmente nos seguintes temas: Câncer de boca; Patologia, imunidade tumoral; Carcinoma espinocelular. Curso: Odontologia Para Pacientes com Necessidades Especiais e Odontologia Hospitalar. Na Escola de Pós é docente do curso: Odontologia Hospitalar."
O curso pode ser cancelado?,"Sim! Você pode cancelar o curso, desde que esteja de acordo com os requisitos previstos no contrato do curso."
O que devo fazer em caso de ausência em alguma disciplina?,"Informe a coordenação do curso ou o professor responsável, justificando o motivo da ausência."
O que é a Escola de Pós da UFG?,"A Escola de Pós da Universidade Federal de Goiás (UFG) é uma iniciativa que visa fortalecer e unificar a oferta de cursos de pós-graduação lato sensu, como especializações, MBAs e residências médicas e multiprofissionais. Seu objetivo é produzir e socializar conhecimentos, formando profissionais capazes de promover a transformação e o desenvolvimento da sociedade. Possui 120 cursos, entre especializações, MBAs e capacitações. Possui, também, 400.000 discentes formados ao longo da história e 64 anos de história mudando a vida de milhares de pessoas."
Os cursos da Escola de Pós UFG são apenas presenciais?,"Não! Na Escola de Pós UFG você pode realizar cursos nas modalidades presencial, hibrida ou EAD."
Os cursos da Escola de Pós UFG são gratuítos?,A Escola de Pós UFG possui alguns cursos gratuitos. Para mais informações você pode conferir a página de cada curso.
Portador de diploma de curso tecnólogo pode fazer MBA ou pós-graduação?,"Sim, os diplomas de cursos superiores de tecnologia são aceitos para MBA e pós-graduação."
PÓS-GRADUAÇÃO EM​ Controladoria e Finanças,"O curso pertence à área de Ciências Sociais Aplicadas. O curso destina-se a profissionais que atuam na área de gestão, controladoria, finanças, custos e administração de empresas, bem como profissionais que atuam na área da docência superior de instituições de ensino públicas e privadas. O curso de Controladoria e Finanças visa capacitar os profissionais dos conhecimentos necessários para desenvolverem, dentro de suas limitações profissionais, o que lhes couber no âmbito operacional em que atuam. Assim, conhecer técnicas para uma boa gestão empresarial é crucial nestas transformações, demandando que o gestor tenha competências específicas para se adequarem a esta realidade. O papel da controladoria ganha expressiva importância por induzir as adaptações necessárias das organizações, através da confecção e análise das informações, contábeis ou não, seja construindo modelos operacionais, ou seja, influenciando o planejamento estratégico, o Controller tem um papel importante na gestão empresarial. Objetivos Específicos: a) Propiciar uma formação conceitual e prática ao profissional nas áreas de Controladoria e Finanças, fornecendo condições para alavancar sua carreira; b) Desenvolver massa crítica às atribuições da controladoria e finanças, suas especificidades, sua importância, seu gerenciamento, etc; c) Instrumentalizá-lo em conceitos e técnicas nessas áreas de conhecimento, que lhe permitirão aplicar em situações práticas de seu dia a dia. Horários: Quinzenalmente às sextas-feiras (18h30 às 22h30) e sábados (08h00 às 12h30 e eventualmente das 14h00min às 18h30min). Local: Prédio da Faculdade de Administração, Ciências Contábeis e Econômicas (FACE), Centros de aula da UFG nos Campus Samambaia e/ou Colemar Natal e Silva. Carga horária: 360h. Modalidade Híbrida. Reconhecido pelo MEC. Início das aulas em definição. Taxa de matrícula de R$ 549,99; Valor da mensalidade: R$ 549,99. Para mais informações: https://escoladepos.ufg.br/cursos/mba-em-controladoria-e-financas/"
PÓS-GRADUAÇÃO EM​ Direito Constitucional e Teoria da Constituição,"O curso pertence à área de Ciências Sociais Aplicadas. O curso destina-se a formação de profissionais na área jurídica que sejam capazes de intervir na vida social e na organização do Estado, procurando a melhor aplicação dos sistemas de Direito e contribuindo para a solução de conflitos sociais. O curso de Direito Constitucional e Teoria da Constituição se identifica a partir de uma perspectiva diversificada e interdisciplinar para pensar o Direito Constitucional. A partir do diálogo estabelecido com diversas teorias contemporâneas fundadas, principalmente, em teorias do reconhecimento em sentido amplo, busca-se pensar os limites constitucionais descentralizando-se do debate meramente institucionalizado. A metodologia a ser empregada consistirá em aulas expositivas dialogadas, seguidas de debates sobre os temas apresentados; ou se seminários, com exposição oral pelos alunos, seguindo-se de debates; ou de trabalhos de pesquisa individual ou em grupo com orientação pelo professor, com posterior apresentação oral e debates pelos alunos. Carga horária: 360 horas. Modalidade 100% Presencial. Reconhecido pelo MEC. Início das aulas 04/10/2024. Valor da mensalidade: R$ 390,00. Para mais informações: https://escoladepos.ufg.br/cursos/direito-constitucional-e-teoria-da-constituicao/"
PÓS-GRADUAÇÃO EM​ Enfrentamento à Violência Contra Mulheres e Meninas,"O curso pertence à área de Ciências Sociais Aplicadas. O curso destina-se a capacitação do Sistema Único de Segurança Pública (SUSP) que atuam no atendimento a vítimas a violência de violência doméstica e em emergências nos centros de operações Militares e Guardas Municipais. O curso de Enfrentamento à Violência Contra Mulheres e Meninas promove a capacitação de profissionais do Sistema Único de Segurança Pública (SUSP), que atuam em unidades que prestam serviços na área de atendimento às mulheres vítimas de violência doméstica e familiar, bem como os profissionais do SUSP que atuem no atendimento emergencial em centros de operações das Polícias Militares e Guardas Municipais. Além disso, tem como objetivo a prestação de serviços educacionais de especialização lato sensu em Enfrentamento à Violência Doméstica e Familiar para os profissionais do SUSP. Carga horária: 360 horas. Modalidade 100% Remota. Reconhecido pelo MEC. Início das aulas em 13/02/2024. Esse curso é gratuito. Para mais informações, acesse: https://escoladepos.ufg.br/cursos/curso-001/"
PÓS-GRADUAÇÃO EM​ Farmácia Oncológica,"O curso pertence à área de Ciências da Saúde. O curso destina-se a profissionais formados no curso de Farmácia. O curso de Farmácia Oncológica tem como objetivo qualificar farmacêuticos para que, ao final do curso, estejam aptos a aplicar toda a base teórica e metodológica necessária para atuar na área de farmácia oncológica. Os encontros presenciais ocorrem aos finais de semana (sextas e sábados), em média uma vez por mês, facilitando a conciliação com a rotina profissional. O diferencial do curso está na ênfase nas aulas práticas, que compõem quase 50% da carga horária total. As atividades práticas são realizadas nos laboratórios da Faculdade de Farmácia e no Hospital das Clínicas da UFG, garantindo ao estudante uma experiência próxima da realidade profissional. Além disso, há oportunidades de participação em projetos de pesquisa, extensão e estágios supervisionados, que complementam a formação acadêmica. Carga horária: 360 horas. Modalidade 100% Presencial. Reconhecido pelo MEC. Início das aulas em Março de 2025. Valor da mensalidade: R$ 580,00. Para mais informações, acesse: https://escoladepos.ufg.br/cursos/especializacao-em-farmacia-oncologica/"
Posso aproveitar disciplinas feitas na graduação?,"Sim! Você pode aproveitar as disciplinas de cursos lato sensu, desde que realizadas no máximo 2 anos antes. Para mais informações confira o Regulamento Geral de Pós-graduação Lato Sensu da UFG (Resolução CEPEC N° 1630/2019: https://files.cercomp.ufg.br/weby/up/1333/o/Resolucao_CEPEC_2019_1630_R_.pdf )"
Posso iniciar a pós-graduação cursando o último semestre da faculdade?,"Sim! Você pode apresentar o comprovante de conclusão do curso superior para a homologação da inscrição no edital de processo seletivo, no entanto é necessário apresentar o diploma de curso superior para efetivar a matrícula."
Posso mudar de curso antes de começar as aulas?,"Sim! Você pode mudar curso, basta ingressar no processo seletivo do novo curso e seguir as regras do edital do mesmo."
Preciso ser graduado em uma área específica para fazer a pós-graduação?,Consulte o edital e a página do curso para verificar quais cursos superiores são aceitos como pré-requisito.
Quais são as formas e condições de pagamento para a realização dos cursos da Escola de Pós UFG?,Você consegue realizar o pagamento dos cursos via boleto bancário ou Pix.
