PERGUNTAS,RESPOSTAS
ESPECIALIZAÇÃO EM​ Estudos Literários e Ensino de Literatura,"O curso pertence à área de Linguística, Letras e Artes. O curso destina-se a profissionais formados em Letras e áreas relacionadas, que tenham interesse na pesquisa acadêmica com foco nos estudos literários e no ensino de literatura. O curso de Especialização em Estudos Literários e Ensino de Literatura se propõe a ampliar os conhecimentos teórico-críticos e práticos dos alunos ingressantes, possibilitando-lhes aperfeiçoar habilidades e competências referentes ao ensino de literatura. Assim como o contato com um  repertório representativo de obras literárias da literatura brasileira e de outras literaturas, seja no âmbito da historiografia literária, seja no da fortuna crítica dos autores enfocados. Neste sentido, o curso propicia aos profissionais da área uma proposta de educação continuada com pesquisadores qualificados que atuam na graduação e em cursos de pós-graduação na área de Letras. É preciso ressaltar, ainda, que a formação continuada de professores da educação básica atende às necessidades de qualificação e capacitação de profissionais que atuam na esfera municipal, estadual e particular de ensino. O curso será realizado por meio de aulas presenciais expositivo-dialogadas, baseadas em leitura, discussão e análise de textos literários, de adaptações fílmicas, de oficinas e de seminários temáticos, contando, também, com estratégias interdisciplinares com outras áreas do saber, além de atividades práticas tendo como objetivo o desenvolvimento de material de apoio didático-pedagógico para uso/aplicação em sala de aula no ensino básico. Carga horária: 360 horas. Modalidade 100% Presencial. Reconhecido pelo MEC. Início das aulas 01/02/2025. Taxa de matrícula de R$ 350,00; Valor da mensalidade: R$ 350,00. Para mais informações, acesse: https://escoladepos.ufg.br/cursos/especializacao-em-estudos-literarios-e-ensino-de-literatura/"
ESPECIALIZAÇÃO EM​ Finanças e Gestão Estratégica de Negócios,"O curso pertence à área de Ciências Sociais Aplicadas. O curso destina-se a gestores, consultores, analistas, administradores, contadores, economistas e outros profissionais que atuam na área de administração de empresas, gerenciamento e finanças empresariais, bem como profissionais que atuem na área da docência superior de instituições de ensino públicas e privadas. O curso de Especialização em Finanças e Gestão Estratégica de Negócios tem por objetivo propiciar capacitação conceitual e prática na gestão de negócios e finanças, fornecendo aos participantes condições para alavancar suas carreiras e desenvolver uma visão estratégica e financeira de mercado, possibilitando aos participantes obter os subsídios necessários à tomada de decisão em contextos empresariais. Vive-se um momento de grandes transformações nos campos social, econômico e político. As decisões empresariais mudam constantemente e com isto as demandas por informação gerencial também. Neste sentido, conhecer técnicas modernas para uma boa gestão financeira e estratégica de negócios é crucial para os gestores angariem competências específicas que se adequem a esta realidade. O papel das disciplinas dos âmbitos financeiro e empresarial ganha expressiva importância por induzir as adaptações necessárias à sobrevivência das organizações, assim como, por fornecer subsídios para a busca de oportunidades de crescimento empresarial, dada a acirrada competitividade do mercado. Tal mercado, amplo e ágil, potencializa a possibilidade de inserção dos profissionais de Finanças e Gestão Estratégica de Negócios, evidenciando a necessidade de que haja um curso de especialização em tal área de trabalho nesta capital, criando um bom momento para que a FACE/UFG inclua em sua gama de cursos de pós-graduação, a Especialização em Finanças e Gestão Estratégica de Negócios. Horários: sexta-feira (18h30 às 22h30) e sábado (08h às 12h30 e 14h às 18h, eventualmente). Duração do curso: 12 Meses. Modalidade Híbrida. Reconhecido pelo MEC. Início das aulas em definição. Para mais informações, acesse: https://escoladepos.ufg.br/cursos/especializacao-em-financas-e-gestao-estrategica-de-negocios/"
ESPECIALIZAÇÃO EM​ Fisiologia Humana Aplicada às Ciências da Saúde,"O curso pertence à área de Ciências Biológicas. O curso destina-se a profissionais graduados na área da saúde que desejam atualizar seus conhecimentos sobre Fisiologia Humana. O curso de Especialização em Fisiologia Humana Aplicada às Ciências da Saúde tem objetivo de capacitar profissionais que buscam conhecimentos avançados em fisiologia e fisiopatologia humana, desde a intrigante Biologia Celular até os complexos Sistemas Cardiovascular, Respiratório, Nervoso, Renal, Digestório e Hormonal. A especialização conta com um corpo docente composto exclusivamente por doutores de renome internacional, com vasta experiência prática e acadêmica nos temas abordados. Além de aulas práticas envolventes sobre os conteúdos e materiais atualizados, que permitirá você se identificar com algumas das linhas de pesquisas desenvolvidas nos programas de Mestrado ou Doutorado em Ciências Fisiológicas da Universidade Federal de Goiás (UFG), preparando-se ainda mais para enfrentar os desafios da prática profissional. Duração do curso: 24 Meses. Modalidade 100% Presencial. Reconhecido pelo MEC. Início das aulas 02/2025. Taxa de matrícula de R$ 30,00; Valor da mensalidade: R$ 395,00. Para mais informações, acesse: https://escoladepos.ufg.br/cursos/fisiologia-humana-aplicada-as-ciencias-da-saude/"
ESPECIALIZAÇÃO EM Gestão e Qualidade Ambiental,"O curso pertence à área de Ciências Agrárias. O curso destina-se a profissionais que desejam atuar na gestão e qualidade ambiental, com foco em diagnóstico e solução de problemas ambientais. O curso de Especialização em Gestão e Qualidade Ambiental, tem como objetivo oferecer aulas teóricas, visitas técnicas e práticas, abordando monitoramento, conservação de ecossistemas e uso de tecnologias sustentáveis para proteção ambiental, culminando na publicação de artigo científico para profissionais que desejam atuar na gestão e qualidade ambiental, com foco em diagnóstico e solução de problemas ambientais. Objetivos Específicos: a) Desenvolver nos participantes competências e habilidades, a fim de que possam elaborar instrumentos para identificar a gênese e a evolução dos problemas ambientais e posterior solução; b) Capacitar os profissionais para monitorar e tratar os dados ambientais; c) Prestar suporte técnico especializado à atividade dos gestores ambientais; d) Gerir medidas de proteção e controle da qualidade ambiental; e) Ordenar o desenvolvimento de recursos naturais, conservar e manejar ecossistemas e espécies nele inseridas; f) Difundir tecnologias, informações e modelos de conservação ambiental do centro oeste do Brasil. Carga horária: 340 horas. Modalidade Híbrida. Reconhecido pelo MEC. Início das aulas 03/08/2024. Taxa de matrícula de R$ 100,00; Valor da mensalidade: R$ 390,00. Para mais informações, acesse: https://escoladepos.ufg.br/cursos/curso-de-especializacao-em-gestao-e-qualidade-ambiental/"
ESPECIALIZAÇÃO EM​ Gestão Pública,"O curso pertence à área de Ciências Sociais Aplicadas. Aperfeiçoe suas competências em gestão pública com o curso EAD da Unidade Acadêmica Especial de Ciências Sociais Aplicadas da Universidade Federal de Goiás. Capacite-se para diagnosticar problemas, negociar com atores sociais e aplicar modelos estratégicos, promovendo mudanças efetivas e éticas no setor público. Finalidade: a) Desenvolver habilidades e capacidades de gestão pública; b) Capacitar gestores e analistas de políticas governamentais; c) Promover articulação e negociação com atores sociais e políticos; d) Diagnosticar e solucionar problemas nas organizações públicas; e) Aplicar planejamento estratégico e gestão em ambientes públicos; f) Incorporar dimensões éticas na gestão pública. Público-Alvo e Vagas: – Destinado a graduados em Administração ou áreas afins; – Total de 150 vagas distribuídas em 7 polos no estado de Goiás; – Reserva de vagas para ações afirmativas conforme política da UFG. Carga Horária e Estrutura Acadêmica: – Total de 390 horas, com prazo máximo de 2 anos para conclusão. – Avaliação com frequência mínima de 75% e aproveitamento de 70%. – Certificação exige aprovação em trabalho final ou monografia. Formato e Organização: – Modalidade: Ensino a distância. – Corpo docente majoritariamente composto por professores da UFG. – Coordenação formada por um coordenador e subcoordenador com titulação mínima de mestre. Certificação: – Certificado de especialização para quem cumprir todos os requisitos. – Certificado de aperfeiçoamento para alunos que concluírem disciplinas sem apresentar o trabalho final. Diferenciais: – Flexibilização curricular voltada à administração pública. – Enfoque na realidade regional e nacional. – Desenvolvimento de análise crítica e abordagem ética. Início das aulas 14/04/2025. Reconhecido pelo MEC. Modalidade 100% a distância. Esse curso é gratuito. Para mais informações, acesse: https://escoladepos.ufg.br/cursos/gestao-publica/"
ESPECIALIZAÇÃO EM Letramento Informacional: Educação para Informação,"O curso pertence à área de Ciências Sociais Aplicadas. O curso destina-se a professores, bibliotecários, profissionais da comunicação e demais graduados interessados no assunto. O curso de Especialização em Letramento Informacional: Educação para a Informação (CELI), promove a educação voltada para a informação, observados os aspectos técnicos, éticos, estéticos, legais e pedagógicos envolvidos na prática informacional. Essa prática envolve a busca, organização, o uso e compartilhamento da informação, independente do suporte em que ela esteja registrada, de forma articulada à proposta pedagógica e à concepção de uma aprendizagem contínua (lifelong learning) e autônoma (aprender a aprender). Duração do curso: 12 Meses. Modalidade 100% Remota. Reconhecido pelo MEC. Início das aulas 01/08/2024. Valor da mensalidade: R$ 180,00. Para mais informações, acesse: https://escoladepos.ufg.br/cursos/especializacao-em-letramento-informacional-educacao-para-informacao/"
ESPECIALIZAÇÃO EM Linguística Aplicada: Ensino-Aprendizagem de Línguas Adicionais,"O curso pertence à área de Linguística, Letras e Artes. O curso destina-se a graduados em cursos reconhecidos pelo Conselho Nacional de Educação (CNE) em Letras e/ou Linguística, licenciados ou bacharéis, ou graduados em Libras; em língua portuguesa como língua de acolhimento e em qualquer área com conhecimento em línguas e que atuem na área de Línguas Adicionais a que se destina este curso. O curso de Especialização em Linguística Aplicada: ensino-aprendizagem de Línguas Adicionais tem como objetivo primordial proporcionar aperfeiçoamento, crescimento intelectual e ascensão profissional aos profissionais de ensino de Línguas Adicionais. Seu currículo foi totalmente pensado para os desafios diários em escolas públicas e privadas o que garante ao cursista conhecimento para ampliar e melhorar a sua atuação na sala de aula. Ainda, oferece ao profissional uma visão crítica sobre a sua profissão e capacita para a realização de pesquisas no ambiente de sala de aula que podem levar a melhoria da prática no âmbito profissional e alicerçar pesquisas futuras. Horários: sábados (8h às 12h e 14h às 18h). Duração do curso: 24 meses. Modalidade Híbrida. Reconhecido pelo MEC. Início das aulas 15/03/2025. Taxa de matrícula de R$ 50,00; Valor da mensalidade: R$ 400,00. Para mais informações, acesse: https://escoladepos.ufg.br/cursos/linguistica-aplicada-ensino-aprendizagem-de-linguas-adicionais/"
ESPECIALIZAÇÃO EM Moda e Inovação,"O curso pertence à área de Linguística, Letras e Artes. O curso destina-se a capacitar profissionais portadores de diploma de curso superior, em Design de Moda e afins. O curso de Especialização em Moda e Inovação busca estabelecer um pensamento e aplicação de práticas e dinâmicas multidisciplinares centradas na inovação de base criativa e cocriativa, oriunda de metodologias diversificadas, onde o aluno será convidado a elaborar sua própria prática, respondendo à aplicabilidade inovativa e sustentável em seu projeto final de curso. Uma dinâmica com foco em estudos de caso, de base integradora, tecnológica, sustentável, inventiva e experimental, mas eficaz tanto na sua aplicação quanto na sua manutenção. Assim, o curso capacita profissionais da área de moda e afins para o desenvolvimento, implementação ou melhorias de projetos, negócios e inovação na área de moda. Objetivos Específicos: a) Oferecer conhecimento científico e tecnológico para a geração de ideias e projetos na área de moda; b) Apresentar teorias da cultura de moda e inovação para a geração de novas ideias; c)Proporcionar um ambiente inovador para a materialização de ideias na área de moda; d) Orientar para a sustentabilidade aplicada na geração de ideias e projetos na área de moda; e) Ofertar um ambiente criativo através da cultura de moda, design e inovação; f) Contribuir na profissionalização da área de moda local e nacionalmente. Horários: quinzenalmente, as segundas-feiras (19h às 22h), quartas-feiras (19h às 22h) e sextas-feiras (19h às 22h). Local: Faculdade de Artes Visuais, Campus Samambaia. Carga horária: 360h. Modalidade Híbrida. Reconhecido pelo MEC. Início das aulas 01/04/2025. Taxa de matrícula de R$ 500,00; Valor da mensalidade: R$ 500,00. Para mais informações, acesse: https://escoladepos.ufg.br/cursos/especializacao-em-moda-e-inovacao/"
ESPECIALIZAÇÃO EM​ Odontologia Hospitalar,"O curso pertence à área de Ciências da Saúde. O curso destina-se a graduados em odontologia, que já tenham realizado uma pós-graduação em cirurgia odontológica. O curso de Especialização em Odontologia Hospitalar, promove a capacitação de cirurgiões-dentista em conhecimentos teóricos e práticos necessários para a realização do atendimento de pacientes críticos, com condições especiais de saúde, em ambiente ambulatorial, domiciliar e hospitalar. O curso é fundamentado nos princípios éticos e embasados em evidências científicas, onde será desenvolvido nas dependências da Faculdade de Odontologia da UFG; Enfermaria/UTI do Hospital das Clínicas da UFG, Hospital Araújo Jorge e hospitais particulares parceiros. Carga horária: 612 horas. Modalidade 100% Presencial. Reconhecido pelo MEC. Início das aulas 15/01/2025. Valor da mensalidade: R$ 1800,00. Para mais informações, acesse: https://escoladepos.ufg.br/cursos/especializacao-em-odontologia-hospitalar/"
"ESPECIALIZAÇÃO EM Perícia, Auditoria e Licenciamento Ambiental","O curso pertence à área de Ciências Agrárias e Ciências Biológicas. O curso destina-se a profissionais portadores de diploma de curso superior, tais como Engenheiros Ambientais, Engenheiros Ambientais e Sanitaristas, Engenheiros Civis, Engenheiros Agrônomos, Biólogos, Geógrafos, Advogados, Administradores de Empresas, Químicos, Economistas e demais profissionais Graduados interessados na área Ambiental. O curso de Especialização em Perícia, Auditoria e Licenciamento Ambiental tem como objetivo qualificar profissionais dos setores público, privado e do terceiro setor quanto à promoção do aprendizado multidisciplinar necessário para o desempenho das atividades de Perícia, Auditoria e licenciamento ambiental, apresentando conceitos, instrumentos legais e técnicos para quem pretende participar das atividades relacionadas. Nesse sentido capacita profissionais para a análise e gestão de projetos de investimento, integrando conceitos de engenharia econômica, técnicas de análise de risco e gestão financeira. Com base prática e científica, prepara gestores para decisões criteriosas, focadas na aplicação produtiva do capital em um ambiente de incerteza e risco. Duração do curso: 24 meses. Modalidade 100% Remota. Reconhecido pelo MEC. Início das aulas 24/03/2025. Valor da mensalidade: R$ 400,00. Para mais informações, acesse: https://escoladepos.ufg.br/cursos/curso-de-especializacao-em-pericia-auditoria-e-licenciamento-ambiental/"
ESPECIALIZAÇÃO EM Políticas Públicas,"O curso pertence à área de Ciências Sociais Aplicadas. O curso pertence à área de Ciências Humanas e Ciências Sociais Aplicadas. O curso destina-se a servidores públicos (efetivos ou comissionados), prestadores de serviço em órgãos públicos da esfera federal, estadual ou municipal; profissionais da iniciativa privada ou terceiro setor com atuação; demais profissionais com em pesquisa com temáticas pertinentes ao campo das políticas públicas. O curso de Especialização em Políticas Públicas tem como objetivos: – Qualificar, em resposta à regular demanda pelo curso, servidores, prestadores de serviço e interessados em ingressar em carreiras do setor público a nível federal, estadual e/ou municipal; – Fomentar atividades de debate e pesquisa sobre políticas públicas que tenham o estado de Goiás e/ou seus municípios como objeto de estudo, contribuindo para a produção de conhecimento e evidências sobre questões atinentes à formulação, implementação, monitoramento e avaliação de políticas relavantes para os governos (estadual e municipais) e tomadores de decisões; – Formar potenciais pesquisadores do campo de políticas públicas, promovendo o estabelecimento de vínculos e integração em redes de pesquisa com acadêmicos e demais profissionais da área pertencentes à Faculdade de Ciências Sociais (FCS), a outras unidades acadêmicas da UFG, a instituições de ensino do estado, e municípios, e de outras unidades da federação, além de órgãos governamentais dedicados à pesquisa; – Consolidar a Especialização em Políticas Públicas em um núcleo de estudos e provisão de conhecimento propício ao desenvolvimento de investigações e estudos técnicos em parcerias com órgãos públicos no estado de Goiás e/ou nos municípios da grande Goiânia. Horários: sextas-feiras (17h00 às 21h00) e sábados (08h00 às 12h00). Carga horária: 360h. Modalidade 100% Presencial. Reconhecido pelo MEC. Início das aulas previsto para 2026. Taxa de matrícula de R$ 300,00; Valor da mensalidade: R$ 300,00. Para mais informações, acesse: https://escoladepos.ufg.br/cursos/especializacao-em-politicas-publicas/"
ESPECIALIZAÇÃO EM Práticas Pedagógicas na Educação Básica,"O curso pertence à área de Ciências Sociais Aplicadas. O curso pertence à área de Ciências Humanas e Ciências Sociais Aplicadas. O curso destina-se a graduados em curso de licenciatura. O curso de Especialização em Práticas Pedagógicas na Educação Básica tem por finalidade: a) Contribuir para a formação de professores e demais agentes que atuam na Educação Básica com foco no desenvolvimento e aprimoramento das práticas pedagógicas por eles desenvolvidas; b) Formar, em nível de pós-graduação Lato Sensu, profissionais da Educação Básica; c) Promover a formação continuada de profissionais da educação básica, com vistas a consolidar as práticas pedagógicas por eles desenvolvidas; d) Contribuir com o fortalecimento e expansão das políticas públicas de formação de professores; e) Refletir sobre o trabalho e práticas pedagógicas desenvolvidas pelos professores em seus ambientes de trabalho; f) Promover o debate crítico sobre formação de professores e suas práticas pedagógicas; g) Produzir conhecimentos em relação ao tema das práticas pedagógicas na Educação Básica. O cumprimento das finalidades será obtido por meio de: a) Manutenção da qualidade do ensino ministrado, do estímulo à investigação científica; b) Flexibilização curricular que conduza ao aprimoramento mais amplo na área da Educação e do Ensino; c) Comprometimento com a realidade regional e nacional; d) Utilização da bibliografia referente à área da educação; e) Identificação e discussão dos problemas da área de estudo, bem como sua interação com áreas afins; f) Desenvolvimento da capacidade de análise e de crítica. Duração do curso: 24 meses. Modalidade 100% Presencial. Reconhecido pelo MEC. Início das aulas 15/05/2024. Esse curso é gratuito. Para mais informações, acesse: https://escoladepos.ufg.br/cursos/especializacao-em-praticas-pedagogicas-na-educacao-basica/"
ESPECIALIZAÇÃO EM​ Psicologia dos Processos Educativos,"O curso pertence à área de Ciências Sociais Aplicadas. O curso destina-se todos os profissionais licenciados(as) em cursos reconhecidos pelo Ministério da Educação. O curso de Especialização em Psicologia dos Processos Educativos é um curso gratuito que tem os seguintes objetivos: a) Aprofundar os fundamentos científicos da psicologia para compreensão dos processos de socialização em contextos diversos visando apreender as mediações constitutivas do sujeito na contemporaneidade e subsidiar práticas profissionais que requerem intervenções educativas; b) Dar continuidade ao processo de formação acadêmica; aprofundar a compreensão dos processos e instâncias de socialização; c) Contribuir para a discussão acerca das condições de intervenção em contextos educativos; d) Contribuir para compreensão acerca das condições de constituição do sujeito contemporaneamente; e) Contribuir para elaboração de intervenções subjetivamente orientadas no campo social. Horários: segunda-feira (noturno), terça-feira (noturno) e quinta-feira (noturno). Local: Faculdade de Educação, da Universidade Federal Goiás. Carga horária do curso: 360 horas. Modalidade 100% Presencial. Reconhecido pelo MEC. Início das aulas 17/03/2025. Esse curso é gratuito. Para mais informações, acesse: https://escoladepos.ufg.br/cursos/especializacao-em-psicologia-dos-processos-educativos/"
ESPECIALIZAÇÃO EM Vigilância Epidemiológica,"O curso pertence à área de Ciências da Saúde. O curso destina-se a médicos, enfermeiros, biomédicos, biólogos, farmacêuticos e outros profissionais da saúde que desejam se aprofundar na prevenção e controle de doenças e na promoção da saúde pública. O curso de Especialização em Vigilância Epidemiológica oferece formação avançada para profissionais de saúde no controle e prevenção de doenças, com base em diretrizes internacionais. Inclui atividades práticas e conexão com especialistas da área. Além de uma sólida base teórica, o curso oferece atividades práticas que simulam situações reais de vigilância em saúde. Duração do curso: 18 Meses. Modalidade Híbrida. Reconhecido pelo MEC. Início das aulas Março/2025. Valor da mensalidade: R$ 450,00. Para mais informações, acesse: https://escoladepos.ufg.br/cursos/especializacao-em-vigilancia-epidemiologica/"
"ESPECIALIZAÇÃO EM Vitivinicultura, Serviços e Produtos","O curso pertence à área de Ciências Biológicas. O curso destina-se a portadores de diploma de graduação de quaisquer áreas do conhecimento, entretanto, oferece-se prioridade à graduados em cursos de Enologia, Agronomia, Farmácia, Química, Engenharia de Alimentos, Engenharia Química, Gastronomia e áreas afins. O curso de Especialização em Vitivinicultura, Serviços e Produtos, compromete-se a promover a capacitação e o aperfeiçoamento de profissionais para atuarem em diferentes áreas deste setor de tradição milenar. Ressalta-se aqui, a notável multidisciplinaridade do setor vitivinícola, hoje em franco desenvolvimento internacional, nacional e sobretudo regional. A região Centro-Oeste já consolidada na produção de uvas de mesa, tem se notabilizado pela qualidade de uvas viníferas e vinhos resultantes, contando já com dezenas de vinícolas e projetos, bem como diversos vinhos premiados. Horários: sextas-feiras (18h às 22h) e sábados (8h às 12h e 14h às 18h). Duração do curso: 18 Meses. Modalidade Híbrida. Reconhecido pelo MEC. Início das aulas 07/03/2025. Taxa de matrícula de R$ 238,00; Valor da mensalidade: R$ 484,00. Para mais informações, acesse: https://escoladepos.ufg.br/cursos/vitivinicultura-produtos-e-servicos-vitivini/"
Existe a opção de trancamento de matrícula?,"Não, conforme o Regulamento Geral da Pós-Graduação Lato Sensu da UFG (Resolução CEPEC N° 1630/2019), não há possibilidade de trancamento de matrícula."
Existe algum canal de interação entre o aluno e o professor?,"Sim! Você consegue falar com o seu professor por meio do sistema acadêmico, por e-mail e pelo ambiente virtual de aprendizagem."
Francine do Couto Lima Moreira,"Cirurgiã-dentista (UFG) – Especialista em Odontologia para Pacientes com Necessidades Especiais (ABOGO) e Odontologia Hospitalar (UFG). Habilitada em Laserterapia (ABODF) e Sedação Inalatória com Óxido Nitroso (EAP GO). Mestre em Odontologia (UFG). Doutora em Ciências da Saúde (UFG). Professora adjunta da Faculdade de Odontologia da Universidade Federal de Goiás. Coordenadora das disciplinas de OPNE e OH da UFG, dos cursos de especialização em OPNE e OH da UFG e do Serviço de Odontologia Hospitalar da FOUFG. Secretária Geral do Conselho Regional de Odontologia de Goiás. Cursos: Especialização em Odontologia para Pacientes com Necessidades Especiais; Especialização em Odontologia Hospitalar, Especialização em Odontopediatria. Na Escola de Pós é docente do curso: Odontologia Hospitalar ; Enfrentamento à Violência Contra Mulheres e Meninas."
